{
  "onboardingId": "plan_v1",
  "schemaVersion": 1,
  "contentVersion": 5,
  "locale": "en",
  "sections": [
    {
      "id": "intro",
      "title": "Welcome",
      "countsTowardProgress": false,
      "questions": [
        {
          "id": "welcome",
          "stage": "onboarding",
          "type": "info",
          "prompt": [
            "Hi there! 👋",
            "I'll ask you a few questions to build your plan. It takes under two minutes, and you can change any answer before you finish."
          ],
          "continueLabel": "Start"
        }
      ]
    },
    {
      "id": "goals",
      "title": "Your goals",
      "subtitle": "So we know where we're headed",
      "questions": [
        {
          "id": "goal_primary",
          "stage": "onboarding",
          "type": "single_choice",
          "prompt": [
            "What do you want to get out of Kalorias?"
          ],
          "options": [
            {
              "id": "lose_weight",
              "title": "Lose weight",
              "description": "Drop fat while keeping muscle",
              "emoji": "🔥"
            },
            {
              "id": "maintain",
              "title": "Maintain my weight",
              "description": "Eat better without moving the scale",
              "emoji": "⚖️"
            },
            {
              "id": "gain_muscle",
              "title": "Build muscle",
              "description": "Gain weight in a controlled way",
              "emoji": "💪"
            }
          ]
        },
        {
          "id": "wants_meal_plan",
          "stage": "onboarding",
          "type": "single_choice",
          "prompt": [
            "Would you like us to put together a meal plan?"
          ],
          "options": [
            {
              "id": "yes",
              "title": "Yes, suggest one",
              "description": "We'll suggest meals for each day",
              "emoji": "🥗"
            },
            {
              "id": "no",
              "title": "No, just counting",
              "description": "You decide what to eat, I'll keep the count",
              "emoji": "📊"
            }
          ]
        },
        {
          "id": "calorie_experience",
          "stage": "onboarding",
          "type": "single_choice",
          "prompt": [
            "Have you counted calories before?"
          ],
          "options": [
            {
              "id": "never",
              "title": "Never",
              "description": "This is my first time",
              "emoji": "🌱"
            },
            {
              "id": "tried",
              "title": "I've tried",
              "description": "I gave up after a few weeks",
              "emoji": "🔁"
            },
            {
              "id": "habitual",
              "title": "Yes, it's a habit",
              "description": "I do it regularly",
              "emoji": "✅"
            }
          ]
        }
      ]
    },
    {
      "id": "about_you",
      "title": "About you",
      "subtitle": "This is how we work out your daily calories",
      "questions": [
        {
          "id": "sex",
          "stage": "onboarding",
          "type": "single_choice",
          "prompt": [
            "What's your biological sex?",
            "It changes the basal metabolism calculation quite a bit, which is why we ask."
          ],
          "options": [
            {
              "id": "male",
              "title": "Male",
              "emoji": "♂️"
            },
            {
              "id": "female",
              "title": "Female",
              "emoji": "♀️"
            },
            {
              "id": "unspecified",
              "title": "Prefer not to say",
              "description": "We'll use a mid-point calculation",
              "emoji": "🤍"
            }
          ]
        },
        {
          "id": "birth_date",
          "stage": "onboarding",
          "type": "date",
          "prompt": [
            "When were you born?"
          ],
          "date": {
            "mode": "date",
            "minDate": "today-100y",
            "maxDate": "today-16y",
            "default": "today-30y",
            "displayFormat": "long"
          }
        },
        {
          "id": "height",
          "stage": "onboarding",
          "type": "measure",
          "prompt": [
            "How tall are you?"
          ],
          "measure": {
            "widget": "wheel",
            "canonicalUnit": "cm",
            "defaultUnit": "ft_in",
            "units": [
              {
                "id": "cm",
                "label": "cm",
                "components": [
                  {
                    "id": "cm",
                    "label": "cm",
                    "min": 120,
                    "max": 240,
                    "step": 1,
                    "default": 170,
                    "decimals": 0,
                    "toCanonical": 1
                  }
                ]
              },
              {
                "id": "ft_in",
                "label": "ft/in",
                "components": [
                  {
                    "id": "ft",
                    "label": "ft",
                    "min": 4,
                    "max": 7,
                    "step": 1,
                    "default": 5,
                    "decimals": 0,
                    "toCanonical": 30.48
                  },
                  {
                    "id": "in",
                    "label": "in",
                    "min": 0,
                    "max": 11,
                    "step": 1,
                    "default": 7,
                    "decimals": 0,
                    "toCanonical": 2.54
                  }
                ]
              }
            ]
          }
        },
        {
          "id": "weight_current",
          "stage": "onboarding",
          "type": "measure",
          "prompt": [
            "How much do you weigh right now?"
          ],
          "measure": {
            "widget": "wheel",
            "canonicalUnit": "kg",
            "defaultUnit": "lb",
            "units": [
              {
                "id": "kg",
                "label": "kg",
                "components": [
                  {
                    "id": "kg",
                    "label": "kg",
                    "min": 30,
                    "max": 250,
                    "step": 0.1,
                    "default": 70,
                    "decimals": 1,
                    "toCanonical": 1
                  }
                ]
              },
              {
                "id": "lb",
                "label": "lb",
                "components": [
                  {
                    "id": "lb",
                    "label": "lb",
                    "min": 66,
                    "max": 550,
                    "step": 0.2,
                    "default": 154,
                    "decimals": 1,
                    "toCanonical": 0.45359237
                  }
                ]
              }
            ]
          }
        },
        {
          "id": "training_frequency",
          "stage": "onboarding",
          "type": "single_choice",
          "prompt": [
            "How many days a week do you train?"
          ],
          "options": [
            {
              "id": "d0",
              "title": "None",
              "description": "I'm not training right now",
              "emoji": "🛋️"
            },
            {
              "id": "d1_2",
              "title": "1 or 2 days",
              "description": "Here and there",
              "emoji": "🚶"
            },
            {
              "id": "d3_4",
              "title": "3 or 4 days",
              "description": "Fairly consistent",
              "emoji": "🏃"
            },
            {
              "id": "d5_6",
              "title": "5 or 6 days",
              "description": "Almost every day",
              "emoji": "🏋️"
            },
            {
              "id": "d7",
              "title": "Every day",
              "description": "No rest days",
              "emoji": "🔥"
            }
          ]
        },
        {
          "id": "lifestyle_activity",
          "stage": "onboarding",
          "type": "single_choice",
          "prompt": [
            "Outside training, what's your day like?",
            "Think about work and how much you move around normally."
          ],
          "options": [
            {
              "id": "sedentary",
              "title": "Sitting most of the day",
              "description": "Office, studying, driving",
              "emoji": "💻"
            },
            {
              "id": "light",
              "title": "On my feet now and then",
              "description": "I get up and walk around often",
              "emoji": "🚶"
            },
            {
              "id": "active",
              "title": "On the move",
              "description": "I walk a lot during the day",
              "emoji": "🏃"
            },
            {
              "id": "very_active",
              "title": "Physical work",
              "description": "I lift things or stand all day",
              "emoji": "🧱"
            }
          ]
        },
        {
          "id": "health_conditions_any",
          "stage": "onboarding",
          "type": "single_choice",
          "prompt": [
            "Do you have any health conditions we should know about?"
          ],
          "options": [
            {
              "id": "yes",
              "title": "Yes",
              "emoji": "🩺"
            },
            {
              "id": "no",
              "title": "No, none",
              "emoji": "👍"
            }
          ]
        },
        {
          "id": "health_conditions",
          "stage": "onboarding",
          "type": "multi_choice",
          "visibleIf": {
            "all": [
              {